nombre,institucion,tipo_beca,monto,fecha_inicio,fecha_cierre,rsh_maximo,nem_minimo,regiones,descripcion,descripcion_larga,url
Gratuidad,Ministerio de Educación,Gratuidad,"100% arancel + matrícula",2025-10-01,2026-03-15,60,,,"Cubre el 100% del arancel y matricula para estudiantes del 60% mas vulnerable en 68 instituciones adscritas a gratuidad.","La Gratuidad es el beneficio mas completo del sistema chileno. Financia el arancel anual completo mas la matricula durante toda la duracion nominal de la carrera. Requisitos: pertenecer al 60% de menores ingresos segun RSH; matricularse en una institucion adscrita (68 en 2026); carrera de pregrado presencial. No pueden acceder quienes ya posean titulo profesional o licenciatura terminal (salvo programas de formacion pedagogica de max 4 semestres). Documentos tipicos: completar FUAS en octubre; certificado RSH actualizado; matricula en institucion adscrita. Los estudiantes antiguos con becas o creditos previos pueden migrar a gratuidad si cumplen requisitos. La gratuidad no es retroactiva sobre creditos ya contraidos. Permite suspension de estudios sin perder el beneficio. Cambio de carrera una sola vez.",https://portal.beneficiosestudiantiles.cl/gratuidad
Beca Bicentenario,Ministerio de Educación,Beca de Arancel,Arancel de referencia anual,2025-10-01,2026-03-15,70,,,"Financia el arancel de referencia anual completo en universidades acreditadas para estudiantes del 70% mas vulnerable con PAES 510 puntos.","La Beca Bicentenario (BB) financia el arancel de referencia anual completo de la carrera. Requisitos: pertenecer al 70% de menores ingresos del pais; puntaje PAES promedio 510 en Competencia Lectora y Matematica (escala 100-1.000); matricularse en universidad del CRUCh o privada acreditada por al menos 4 anos. Estudiantes PACE eximidos del requisito PAES. Para renovar: 60% de asignaturas en primer ano o 70% en superiores. No tener titulo profesional previo ni haber recibido becas de arancel Mineduc en dos oportunidades anteriores. Documentos tipicos: FUAS completado; certificado RSH; matricula; concentracion de notas (renovantes). Cupos especiales para estudiantes en situacion de discapacidad.",https://portal.beneficiosestudiantiles.cl/becas-y-creditos/beca-bicentenario-bb
Beca Nuevo Milenio I,Ministerio de Educación,Beca de Arancel,"$600.000 anual",2025-10-01,2026-03-15,70,5.0,,"Financia hasta $600.000 del arancel anual de carreras tecnico-profesionales para estudiantes del 70% mas vulnerable con NEM 5.0.","La Beca Nuevo Milenio I (BNM I) financia hasta $600.000 del arancel anual para carreras tecnico-profesionales en CFT. IP. universidades o escuelas de FF.AA. acreditadas. Requisitos: pertenecer al 70% de menores ingresos; NEM 5.0; matricularse en carrera tecnica o profesional en IP acreditado. Estudiantes antiguos deben acreditar avance academico (60% primer ano; 70% superiores). Cupos especiales para discapacidad. No requiere puntaje PAES. No pueden acceder quienes posean titulo tecnico o profesional previo. Documentos tipicos: FUAS; certificado RSH; concentracion de notas EMTP; matricula.",https://portal.beneficiosestudiantiles.cl/becas-y-creditos/beca-nuevo-milenio-bnm
Beca Nuevo Milenio II,Ministerio de Educación,Beca de Arancel,"$860.000 anual",2025-10-01,2026-03-15,50,5.0,,"Variante de BNM exclusiva para primer ano del 50% mas vulnerable con NEM 5.0 en instituciones acreditadas 3+ anos.","La Beca Nuevo Milenio II (BNM II) es la variante premium de la BNM. exclusiva para estudiantes de primer ano que pertenezcan al 50% de menores ingresos. Financia hasta $860.000 del arancel anual. Requiere matricularse en instituciones con al menos 3 anos de acreditacion. NEM minimo 5.0. Solo para primer ano. Documentos tipicos: FUAS; certificado RSH; concentracion de notas EMTP; matricula en primer ano.",https://portal.beneficiosestudiantiles.cl/becas-y-creditos/beca-nuevo-milenio-bnm
Beca Juan Gomez Millas,Ministerio de Educación,Beca de Arancel,"$1.150.000 anual",2025-10-01,2026-03-15,70,,,"Hasta $1.150.000 del arancel anual para estudiantes del 70% mas vulnerable con PAES 510 puntos en cualquier institucion acreditada.","La Beca Juan Gomez Millas (BJGM) es una de las becas mas flexibles del Mineduc: financia hasta $1.150.000 del arancel anual en cualquier tipo de institucion acreditada. Requisitos: pertenecer al 70% de menores ingresos; PAES promedio 510 puntos. Estudiantes PACE eximidos. Para renovar: 60% de ramos aprobados en primer ano; 70% en superiores. Documentos tipicos: FUAS; certificado RSH; matricula; concentracion de notas. Cupos especiales para discapacidad.",https://portal.beneficiosestudiantiles.cl/becas-y-creditos/beca-juan-gomez-millas-bjgm
