nombre,institucion,tipo_beca,monto,fecha_inicio,fecha_cierre,rsh_maximo,nem_minimo,regiones,descripcion,descripcion_larga,url,documentos_requeridos
Beca Universidad de Chile,Universidad de Chile,Beca de Arancel,100% arancel anual,2026-01-01,2026-12-31,40,,RM,BUCH. 100% arancel para estudiantes del 40% mas vulnerable con excelencia academica. Incluye matricula.,La Beca Universidad de Chile (BUCH) es el beneficio institucional mas importante. Cubre 100% del arancel anual mas matricula para estudiantes de primer ano con excelencia academica y pertenecientes al 40% de menores ingresos.,https://uchile.cl/presentacion/asuntos-estudiantiles/beneficios-y-becas,"[OBLIGATORIO] Cartola del Registro Social de Hogares que acredite estar dentro del 40% de menores ingresos; [OBLIGATORIO] Certificado de Concentracion de Notas (NEM) emitido por el Mineduc; [OBLIGATORIO] Certificado oficial de Puntajes PAES emitido por el DEMRE"
Beca Andres Bello,Universidad de Chile,Beca de Excelencia Academica,50% arancel anual,2026-01-01,2026-12-31,,"5.8",RM,BAB. 50% del arancel anual para estudiantes con NEM 5.8 y puntaje PAES destacado.,La Beca Andres Bello (BAB) reconoce la excelencia academica con 50% de descuento del arancel anual. Requiere NEM 5.8 y PAES en percentil superior.,https://uchile.cl/presentacion/asuntos-estudiantiles/beneficios-y-becas,"[OBLIGATORIO] Certificado oficial de Puntajes PAES emitido por el DEMRE; [OBLIGATORIO] Certificado de Concentracion de Notas (NEM) emitido por el Mineduc"
Beca de Atencion Economica,Universidad de Chile,Beca de Mantencion,$50.000 a $120.000 mensual,2026-01-01,2026-12-31,60,,RM,BAE. Apoyo economico mensual de emergencia para estudiantes con situacion socioeconomica critica.,La Beca de Atencion Economica (BAE) de la UChile entrega apoyo mensual variable para estudiantes con situaciones economicas criticas que pongan en riesgo la continuidad de estudios.,https://uchile.cl/presentacion/asuntos-estudiantiles/beneficios-y-becas,"[OBLIGATORIO] Formulario de Caracterizacion Estudiantil (FOCES) completado integramente en el portal UChile; [OBLIGATORIO] Cartola del RSH actualizada; [OBLIGATORIO] Carpeta de acreditacion de ingresos del grupo familiar (ultimas 12 liquidaciones de sueldo. boletas de honorarios o certificado de cotizaciones de AFP)"
Beca de Alimentacion UChile,Universidad de Chile,Beca de Alimentacion,$35.000 mensual casino,2026-01-01,2026-12-31,60,,RM,Tarjeta de alimentacion para casinos UChile. Complementa BAES de JUNAEB.,La Beca de Alimentacion de la UChile complementa la BAES con tarjeta adicional de $35.000 mensuales para uso en casinos del campus.,https://uchile.cl/presentacion/asuntos-estudiantiles/beneficios-y-becas,"[OBLIGATORIO] Cartola del Registro Social de Hogares actualizada; [OBLIGATORIO] Certificado de matricula vigente; [OBLIGATORIO] Cartola de alumno regular"
Beca Deportiva UChile,Universidad de Chile,Beca Deportiva,30% descuento arancel semestral,2026-01-01,2026-12-31,,,RM,30% de descuento del arancel para deportistas de selecciones UChile.,Beca Deportiva de la Universidad de Chile para estudiantes de selecciones deportivas oficiales.,https://uchile.cl/presentacion/asuntos-estudiantiles/beneficios-y-becas,"[OBLIGATORIO] Curriculum Deportivo visado y respaldado; [OBLIGATORIO] Certificado de vigencia emitido por una federacion deportiva reconocida"
Beca Hijos de Funcionarios,Universidad de Chile,Beca de Arancel,50% arancel anual,2026-01-01,2026-12-31,,,RM,50% del arancel para hijos de funcionarios de la UChile con 2+ anos de antiguedad.,Beca para hijos de academicos o administrativos de planta o contrata de la UChile.,https://uchile.cl/presentacion/asuntos-estudiantiles/beneficios-y-becas,"[OBLIGATORIO] Certificado de Nacimiento del estudiante con asignacion familiar; [OBLIGATORIO] Certificado de Antiguedad Laboral emitido por la Direccion de Recursos Humanos de la UChile acreditando el vinculo del sostenedor"
Beca de Residencia Universitaria,Universidad de Chile,Beca de Mantencion,Cupo en residencia o subsidio $80.000 mensual,2026-01-01,2026-12-31,60,,RM,Alojamiento en residencias universitarias o subsidio de arriendo para estudiantes de regiones.,La Beca de Residencia de la UChile ofrece cupo en Hogar Universitario o subsidio de arriendo para estudiantes de regiones distintas a la Metropolitana.,https://uchile.cl/presentacion/asuntos-estudiantiles/beneficios-y-becas,"[OBLIGATORIO] Formulario de Caracterizacion Estudiantil (FOCES) completado en portal UChile; [OBLIGATORIO] Cartola del RSH actualizada; [OBLIGATORIO] Carpeta de acreditacion de ingresos del grupo familiar; [OBLIGATORIO] Certificado de Residencia original emitido por la junta de vecinos o notaria de la comuna de origen"
