nombre,institucion,tipo_beca,monto,fecha_inicio,fecha_cierre,rsh_maximo,nem_minimo,regiones,descripcion,descripcion_larga,url,documentos_requeridos
Beca Puntaje PAES UDP,Universidad Diego Portales,Beca de Excelencia Academica,35% descuento arancel anual,2026-01-01,2026-12-31,,"6.0",RM,Descuento del 35% del arancel para estudiantes con puntaje PAES en percentil superior y NEM 6.0 o superior.,Beca Puntaje PAES de la UDP que otorga 35% de descuento del arancel anual para estudiantes con puntaje PAES destacado y NEM 6.0 minimo. Renovacion automatica con promedio semestral 5.0. Documentos: resultados PAES. concentracion de notas EM. matricula UDP. Disponible en todas las facultades.,https://admision.udp.cl/becas-y-beneficios/becas-y-beneficios-udp/,[OBLIGATORIO] Certificado de matricula o alumno regular; [OPCIONAL] Registro Social de Hogares
Beca Distincion Trayectorias Educativas UDP,Universidad Diego Portales,Beca de Excelencia Academica,40% descuento arancel anual,2026-01-01,2026-12-31,,,RM,Descuento del 40% del arancel para estudiantes que obtuvieron Distincion a las Trayectorias Educativas (DTE) en la PAES.,Beca DTE de la UDP con 40% de descuento del arancel anual para estudiantes que hayan obtenido la Distincion a las Trayectorias Educativas en la PAES. Reconocimiento al rendimiento academico excepcional durante la ensenanza media. Renovacion con promedio semestral 5.0. Documentos: certificado DTE. resultados PAES. matricula UDP.,https://admision.udp.cl/becas-y-beneficios/becas-y-beneficios-udp/,[OBLIGATORIO] Certificado de matricula o alumno regular; [OPCIONAL] Registro Social de Hogares
Beca Deportista Destacado UDP,Universidad Diego Portales,Beca Deportiva,30% descuento arancel semestral,2026-01-01,2026-12-31,,,RM,Descuento del 30% del arancel para deportistas destacados que representen a la UDP en competencias.,Beca Deportista Destacado UDP con 30% de descuento del arancel semestral para estudiantes de selecciones deportivas oficiales. Documentos: certificacion Direccion de Deportes UDP. curriculum deportivo. cartola de alumno regular. Renovacion condicionada a participacion activa y rendimiento academico.,https://admision.udp.cl/becas-y-beneficios/becas-y-beneficios-udp/,[OBLIGATORIO] Certificado de matricula o alumno regular; [OPCIONAL] Registro Social de Hogares
Beca Bachillerato Internacional UDP,Universidad Diego Portales,Beca de Excelencia Academica,30% descuento arancel anual,2026-01-01,2026-12-31,,,RM,Descuento del 30% del arancel para estudiantes egresados del programa de Bachillerato Internacional con diploma IB.,Beca Bachillerato Internacional de la UDP con 30% de descuento del arancel anual para estudiantes que hayan completado y aprobado el Diploma del Bachillerato Internacional (IB). Documentos: diploma IB. resultados PAES complementarios. matricula UDP. Renovacion con promedio semestral 5.0.,https://admision.udp.cl/becas-y-beneficios/becas-y-beneficios-udp/,[OBLIGATORIO] Certificado de matricula o alumno regular; [OPCIONAL] Registro Social de Hogares
Beca de Cesantia UDP,Universidad Diego Portales,Beca de Arancel,Descuento especial segun evaluacion,2026-01-01,2026-12-31,60,,RM,Beca de apoyo para estudiantes cuyo sostenedor familiar se encuentre en situacion de cesantia.,Beca de Cesantia UDP para estudiantes cuyo sostenedor financiero acredite situacion de cesantia. Otorga descuento especial del arancel segun evaluacion de la Direccion de Asuntos Estudiantiles. Requiere acreditar situacion de cesantia con documentacion AFC o finiquito. Renovable mientras se mantenga la situacion.,https://admision.udp.cl/becas-y-beneficios/becas-y-beneficios-udp/,[OBLIGATORIO] Certificado de matricula o alumno regular; [OPCIONAL] Registro Social de Hogares
Beca Convenio de Descuento UDP,Universidad Diego Portales,Descuento Institucional,10% a 30% descuento arancel,2026-01-01,2026-12-31,,,,Descuento entre 10% y 30% para trabajadores de empresas e instituciones en convenio con la UDP.,Beca Convenio de Descuento UDP con descuento variable entre 10% y 30% del arancel segun el acuerdo corporativo. Para trabajadores de empresas en convenio y sus cargas familiares. Documentos: certificado laboral. documento que acredite parentesco si aplica. cartola de alumno regular. Renovacion semestral.,https://admision.udp.cl/becas-y-beneficios/becas-y-beneficios-udp/,[OBLIGATORIO] Certificado de matricula o alumno regular; [OPCIONAL] Registro Social de Hogares