nombre,institucion,tipo_beca,monto,fecha_inicio,fecha_cierre,rsh_maximo,nem_minimo,regiones,descripcion,descripcion_larga,url
Beca Puntaje PAES UMayor,Universidad Mayor,Beca de Excelencia Academica,30% descuento arancel anual,2026-01-01,2026-12-31,,"5.8","RM",Descuento del 30% del arancel para estudiantes con puntaje PAES destacado y NEM 5.8 o superior.,Beca Puntaje PAES de la Universidad Mayor que otorga 30% de descuento del arancel anual para estudiantes con puntaje PAES en percentil superior y NEM 5.8 minimo. Renovacion automatica con promedio semestral 5.0. Documentos: resultados PAES. concentracion de notas EM. matricula UMayor.,https://www.admisionmayor.cl/becas-y-creditos
Beca Deportiva UMayor,Universidad Mayor,Beca Deportiva,25% descuento arancel semestral,2026-01-01,2026-12-31,,,"RM",Descuento del 25% del arancel para deportistas destacados que representen a la UMayor en competencias nacionales.,Beca Deportiva UMayor con 25% de descuento del arancel semestral para estudiantes de selecciones deportivas oficiales. Documentos: certificacion Direccion de Deportes UMayor. curriculum deportivo. cartola de alumno regular. Renovacion condicionada a participacion activa y rendimiento academico.,https://www.admisionmayor.cl/becas-y-creditos
Beca Copago UMayor,Universidad Mayor,Beca de Arancel,Complemento de arancel para cubrir brecha entre beneficio estatal y arancel real,2026-01-01,2026-12-31,60,,,Beca que complementa beneficios estatales cubriendo total o parcialmente la diferencia entre arancel de referencia y arancel real UMayor.,Beca Copago UMayor que complementa beneficios estatales para estudiantes del 60% mas vulnerable. Documentos: certificado de asignacion de beneficio estatal. matricula vigente. cartola de alumno regular. Renovacion automatica.,https://www.admisionmayor.cl/becas-y-creditos
Beca Familiar UMayor,Universidad Mayor,Beca de Arancel,15% descuento arancel anual,2026-01-01,2026-12-31,,,,"Descuento del 15% para familiares directos de estudiantes activos o titulados de la UMayor.",Beca Familiar UMayor con 15% de descuento del arancel para hijos. hermanos y conyuges de alumnos activos o titulados. Documentos: certificado de alumno regular del familiar. certificado de parentesco. Renovacion semestral.,https://www.admisionmayor.cl/becas-y-creditos
Beca Talento Emprendedor UMayor,Universidad Mayor,Beca de Arancel,20% descuento arancel anual,2026-01-01,2026-12-31,,,,"Descuento del 20% del arancel para estudiantes que acrediten participacion en proyectos de innovacion o emprendimiento.",Beca Talento Emprendedor UMayor con 20% de descuento para estudiantes con proyectos de innovacion o emprendimiento acreditados. Documentos: portafolio de proyecto. carta de recomendacion. concentracion de notas. matricula vigente. Renovable con participacion activa en programas de innovacion UMayor.,https://www.admisionmayor.cl/becas-y-creditos
Beca Alumni UMayor,Universidad Mayor,Beca de Arancel,20% descuento arancel anual,2026-01-01,2026-12-31,,,,Descuento del 20% para titulados UMayor que deseen cursar una segunda carrera.,Beca Alumni UMayor con 20% de descuento del arancel para exalumnos titulados que ingresen a una nueva carrera. Documentos: certificado de titulo UMayor. matricula vigente. Renovacion automatica.,https://www.admisionmayor.cl/becas-y-creditos
