nombre,institucion,tipo_beca,monto,fecha_inicio,fecha_cierre,rsh_maximo,nem_minimo,regiones,descripcion,descripcion_larga,url
Beca Excelencia Academica Santo Tomas,Santo Tomás,Beca de Excelencia Academica,30% descuento arancel semestral,2026-01-01,2026-12-31,,"5.8",,"30% de descuento del arancel semestral para estudiantes con NEM 5.8 o superior. Renovable con promedio 5.5.","La Beca Excelencia Academica de Santo Tomas reconoce a los estudiantes que ingresan con un NEM igual o superior a 5.8 con un 30% de descuento del arancel semestral durante toda la carrera. La renovacion es automatica manteniendo promedio semestral 5.5 o superior y calidad de alumno regular. Documentos requeridos: concentracion de notas de ensenanza media; licencia de ensenanza media; matricula vigente. Si el promedio baja de 5.5. el beneficio se suspende hasta recuperar el rendimiento. Disponible en Universidad. IP y CFT Santo Tomas en todas sus sedes.",https://www.santotomas.cl/admision/becas-y-beneficios
Beca Deportiva Santo Tomas,Santo Tomás,Beca Deportiva,25% descuento arancel semestral,2026-01-01,2026-12-31,,,,25% de descuento del arancel para deportistas de selecciones nacionales o regionales que representen a Santo Tomas en competencias.,"La Beca Deportiva Santo Tomas apoya a estudiantes que acrediten participacion en selecciones deportivas nacionales. regionales o federaciones reconocidas. Otorga un 25% de descuento del arancel semestral. El estudiante debe representar activamente a Santo Tomas en competencias interuniversitarias. Documentos requeridos: certificacion de federacion o club afiliado; curriculum deportivo; concentracion de notas; cartola de alumno regular. La renovacion esta condicionada a rendimiento academico minimo. asistencia a entrenamientos y participacion en competencias.",https://www.santotomas.cl/admision/becas-y-beneficios
Beca Copago Santo Tomas,Santo Tomás,Beca de Arancel,Complemento de arancel para cubrir diferencia entre beneficio estatal y arancel real,2026-01-01,2026-12-31,60,,,Beca de copago que cubre la diferencia entre el arancel de referencia del beneficio estatal y el arancel real de Santo Tomas para estudiantes con Gratuidad o becas Mineduc.,"La Beca Copago Santo Tomas complementa los beneficios estatales (Gratuidad. Beca Bicentenario. Beca Nuevo Milenio. etc.) cubriendo total o parcialmente la brecha entre el arancel de referencia fijado por Mineduc y el arancel real de la carrera en Santo Tomas. Dirigida a estudiantes del 60% mas vulnerable que ya cuenten con un beneficio estatal de arancel. Documentos requeridos: certificado de asignacion de beneficio estatal; matricula vigente en Santo Tomas; cartola de alumno regular. La renovacion es automatica mientras se mantenga el beneficio estatal y la calidad de alumno regular. Este beneficio asegura que los estudiantes vulnerables no tengan que pagar diferencia de arancel.",https://www.santotomas.cl/admision/becas-y-beneficios
Beca Titulado Santo Tomas,Santo Tomás,Beca de Arancel,15% descuento arancel semestral,2026-01-01,2026-12-31,,,,Descuento del 15% para titulados de Santo Tomas que deseen cursar una segunda carrera en la institucion.,"La Beca Titulado Santo Tomas es un beneficio para exalumnos que hayan obtenido su titulo en cualquier nivel (CFT. IP o Universidad) y deseen continuar estudios en otra carrera de Santo Tomas. Otorga un 15% de descuento del arancel semestral durante toda la nueva carrera. Documentos requeridos: certificado de titulo emitido por Santo Tomas; concentracion de notas de la carrera anterior; matricula vigente en la nueva carrera. La renovacion es automatica manteniendo calidad de alumno regular. Compatible con CAE y otros creditos.",https://www.santotomas.cl/admision/becas-y-beneficios
Beca Familiar Santo Tomas,Santo Tomás,Beca de Arancel,10% descuento arancel semestral,2026-01-01,2026-12-31,,,,Descuento del 10% para familiares directos de estudiantes activos o titulados de Santo Tomas.,"La Beca Familiar Santo Tomas otorga un 10% de descuento del arancel semestral a familiares directos de estudiantes o titulados de la institucion. Beneficiarios: hijos. hermanos y conyuges de alumnos activos o egresados de cualquier sede Santo Tomas. Documentos requeridos: certificado de alumno regular o titulo del familiar Santo Tomas; certificado de nacimiento o matrimonio que acredite vinculo; cartola de alumno regular del beneficiario. La renovacion es semestral manteniendo calidad de alumno regular. Si el titular del vinculo egresa. el beneficiario mantiene el descuento.",https://www.santotomas.cl/admision/becas-y-beneficios
Beca Convenio Empresas Santo Tomas,Santo Tomás,Descuento Institucional,10% a 30% descuento arancel,2026-01-01,2026-12-31,,,,Descuento entre 10% y 30% para trabajadores de empresas en convenio con Santo Tomas y sus cargas familiares.,"La Beca Convenio Empresas Santo Tomas es un beneficio corporativo para trabajadores de empresas con convenio vigente y sus cargas familiares directas. El porcentaje varia entre 10% y 30% del arancel segun el acuerdo con cada empresa. Documentos requeridos: certificado laboral vigente; contrato de trabajo o certificado RRHH; documento que acredite parentesco si aplica carga familiar; cartola de alumno regular. La renovacion semestral requiere que el trabajador mantenga su vinculo laboral. Si el vinculo termina. el beneficio se pierde al finalizar el semestre en curso.",https://www.santotomas.cl/admision/becas-y-beneficios
